group,gender,spk_id,user_id,batch_id,audio_id,sentence,audio,duration_seconds
NM,M,Spk2,U_2df01f27aa,75_100,Nyanja_NM_Spk2_U_2df01f27aa_Utterance_17,mphundu mzace wa mwamuna anacita cinthu cimene iye sanakondwere naco ndipo aanatembenuzila cithunzithunzi cake ku cipupa,Nyanja_NM_Spk2_U_2df01f27aa_Utterance_17_75_100.wav,16.982
NM,M,Spk2,U_2df01f27aa,75_100,Nyanja_NM_Spk2_U_2df01f27aa_Utterance_18,ndikukonda momasuka pamene azibambo ayesesa kupeza cifuniro ndikukonda ndi mtima onse pamene ali kubwelera ku mathokodzo,Nyanja_NM_Spk2_U_2df01f27aa_Utterance_18_75_100.wav,16.053
NM,M,Spk2,U_2df01f27aa,75_100,Nyanja_NM_Spk2_U_2df01f27aa_Utterance_19,akhala akufunafuna ku kwatira hilda zaka zonse zapitazi,Nyanja_NM_Spk2_U_2df01f27aa_Utterance_19_75_100.wav,8.805
NM,M,Spk2,U_2df01f27aa,75_100,Nyanja_NM_Spk2_U_2df01f27aa_Utterance_20,ndi paci suweni muziwe onsefe ndife asuweni,Nyanja_NM_Spk2_U_2df01f27aa_Utterance_20_75_100.wav,7.684
NM,M,Spk2,U_2df01f27aa,75_100,Nyanja_NM_Spk2_U_2df01f27aa_Utterance_21,pemphelani mutisate pamodzi ndi anthu anga ndi a ambuya anga a sherriff,Nyanja_NM_Spk2_U_2df01f27aa_Utterance_21_75_100.wav,8.494
NM,M,Spk2,U_2df01f27aa,75_100,Nyanja_NM_Spk2_U_2df01f27aa_Utterance_22,sindine wabwino kopotsa kwa iwe ndipo uyenera kupewetsedwa ku kutengera cibwenzi capamtima copitilira ca mdziko,Nyanja_NM_Spk2_U_2df01f27aa_Utterance_22_75_100.wav,15.393
NM,M,Spk2,U_2df01f27aa,75_100,Nyanja_NM_Spk2_U_2df01f27aa_Utterance_23,koma anakwanits bwanji kucipanga motsamala,Nyanja_NM_Spk2_U_2df01f27aa_Utterance_23_75_100.wav,7.064
NM,M,Spk2,U_2df01f27aa,75_100,Nyanja_NM_Spk2_U_2df01f27aa_Utterance_24,kodi siukudziwa cimodzi pa ma kandulo ocedwa bacon ndi tonnay kodi siungathe kusimba nkhani zodyelamo,Nyanja_NM_Spk2_U_2df01f27aa_Utterance_24_75_100.wav,12.771
NM,M,Spk9,U_8105853265,425_450,Nyanja_NM_Spk9_U_8105853265_Utterance_1,paulo anyadira mpingo wace osati cifukwa ca kuyamikidwa kwace koma kuyamikidwa kwa ambuye,Nyanja_NM_Spk9_U_8105853265_Utterance_1_425_450.wav,12.281
NM,M,Spk9,U_8105853265,425_450,Nyanja_NM_Spk9_U_8105853265_Utterance_2,koma sindinu munthuamene adziwa kukonda  okendedwa wanga,Nyanja_NM_Spk9_U_8105853265_Utterance_2_425_450.wav,6.74
NM,M,Spk9,U_8105853265,425_450,Nyanja_NM_Spk9_U_8105853265_Utterance_3,alexander anaima nazigwedeza mokwiiya inde ndiziwa kuti ndine wamantha,Nyanja_NM_Spk9_U_8105853265_Utterance_3_425_450.wav,9.11
NM,M,Spk9,U_8105853265,425_450,Nyanja_NM_Spk9_U_8105853265_Utterance_4,oopani inu cifukwa ndizatsowa ndipo simuzandionanso,Nyanja_NM_Spk9_U_8105853265_Utterance_4_425_450.wav,7.479
NM,M,Spk9,U_8105853265,425_450,Nyanja_NM_Spk9_U_8105853265_Utterance_5,sungani mau anga muzamupeza ali olimba koposa kwa iwe aye ndipo wakuya kwambiri,Nyanja_NM_Spk9_U_8105853265_Utterance_5_425_450.wav,13.645
NM,M,Spk9,U_8105853265,425_450,Nyanja_NM_Spk9_U_8105853265_Utterance_6,khalani m'malo mwanu ndipo tione  cimene galasi litha kukuonetsani,Nyanja_NM_Spk9_U_8105853265_Utterance_6_425_450.wav,9.191
NM,M,Spk9,U_8105853265,425_450,Nyanja_NM_Spk9_U_8105853265_Utterance_7,mungathe kuyamba ndi kunyamula ndodo ndikulemba ma numbala,Nyanja_NM_Spk9_U_8105853265_Utterance_7_425_450.wav,6.968
NM,M,Spk9,U_8105853265,425_450,Nyanja_NM_Spk9_U_8105853265_Utterance_8,ndinali wofulumira kuti ndibwere kwa iwe wasiya citseko cako cosakhomedwa,Nyanja_NM_Spk9_U_8105853265_Utterance_8_425_450.wav,11.765
NM,M,Spk9,U_8105853265,425_450,Nyanja_NM_Spk9_U_8105853265_Utterance_9,ino tsopano ndi nthawi ya mpepo kunja kwa zitseko unaganiza mtengo,Nyanja_NM_Spk9_U_8105853265_Utterance_9_425_450.wav,10.505
NM,M,Spk9,U_8105853265,425_450,Nyanja_NM_Spk9_U_8105853265_Utterance_10,pamene ndinali munyamata wa cicepeele ndinali kuganiza kuti paulo anali kucita/kupanga zambiri mu utumiki wace,Nyanja_NM_Spk9_U_8105853265_Utterance_10_425_450.wav,11.983
NM,M,Spk9,U_8105853265,425_450,Nyanja_NM_Spk9_U_8105853265_Utterance_11,ndi zimenezi zomwe ndikukupempha kuti usinthe pa zooipa zimene wandicita,Nyanja_NM_Spk9_U_8105853265_Utterance_11_425_450.wav,6.701
NM,M,Spk9,U_8105853265,425_450,Nyanja_NM_Spk9_U_8105853265_Utterance_12,nthawi yonseyo imene ali kulankhula naine maso ake ang'ono-ang'ono ndiponso okwiya anali kundisata,Nyanja_NM_Spk9_U_8105853265_Utterance_12_425_450.wav,14.023
NM,M,Spk9,U_8105853265,425_450,Nyanja_NM_Spk9_U_8105853265_Utterance_13,ndikhumba kuti sindinalire kwambiri anatero alice ali kusambira pofuna kupeza pocookera,Nyanja_NM_Spk9_U_8105853265_Utterance_13_425_450.wav,13.728
NM,M,Spk9,U_8105853265,425_450,Nyanja_NM_Spk9_U_8105853265_Utterance_14,wokondedwa wanga ndiphunzitseko kukhala munthuoyamikira momwe iwe umacitira zabwino,Nyanja_NM_Spk9_U_8105853265_Utterance_14_425_450.wav,10.958
NM,M,Spk9,U_8105853265,425_450,Nyanja_NM_Spk9_U_8105853265_Utterance_15,ukali wa mzangayo sunacepelere kucokera pomwe analetsedwa kupezeka ku malo omwe iye anakondetsetsa omwe anali pafupi ndi kanjira kocedwa baker,Nyanja_NM_Spk9_U_8105853265_Utterance_15_425_450.wav,20.019
NM,M,Spk9,U_8105853265,425_450,Nyanja_NM_Spk9_U_8105853265_Utterance_16,ananvera kunjenjemera kwa cinthu cimene cinali cikuthamanga camaonekedwe a cikasu patsogoro pace,Nyanja_NM_Spk9_U_8105853265_Utterance_16_425_450.wav,16.402
NM,M,Spk9,U_8105853265,425_450,Nyanja_NM_Spk9_U_8105853265_Utterance_17,anakana poyamba kunva uphungu wosamala ici sicinali conyansa kulingana ndi cilengedwe ca mnyamatayu,Nyanja_NM_Spk9_U_8105853265_Utterance_17_425_450.wav,12.992
NM,M,Spk9,U_8105853265,425_450,Nyanja_NM_Spk9_U_8105853265_Utterance_18,kodi nciani khutu dziwa la madzi yoopsya kutengako mbali ku za cilengedwe,Nyanja_NM_Spk9_U_8105853265_Utterance_18_425_450.wav,9.68
NM,M,Spk9,U_8105853265,425_450,Nyanja_NM_Spk9_U_8105853265_Utterance_19,ngati zicitidwe za zinthu ndi zoletsedwa mwina kowawitsa sicikutanthauza kuti zicitidwezo ndi zosayenera,Nyanja_NM_Spk9_U_8105853265_Utterance_19_425_450.wav,14.134
NM,M,Spk9,U_8105853265,425_450,Nyanja_NM_Spk9_U_8105853265_Utterance_20,manyazi akugwireni nzika zinalira iye ine tinagwiridwa ndi manyazi cifukwa ca anzathu a ku nottingham,Nyanja_NM_Spk9_U_8105853265_Utterance_20_425_450.wav,14.884
NM,M,Spk9,U_8105853265,425_450,Nyanja_NM_Spk9_U_8105853265_Utterance_21,tsopano mungathe kumufunsa mafunso pa ukatukumeni dedalus,Nyanja_NM_Spk9_U_8105853265_Utterance_21_425_450.wav,8.31
NM,M,Spk9,U_8105853265,425_450,Nyanja_NM_Spk9_U_8105853265_Utterance_22,obvina a kaleacepetsedwa mzifuniro zao mkupita kwa nthawi,Nyanja_NM_Spk9_U_8105853265_Utterance_22_425_450.wav,8.855
NM,M,Spk9,U_8105853265,425_450,Nyanja_NM_Spk9_U_8105853265_Utterance_23,ndikupita ku bwalo ya milandu ball anayankha andalla,Nyanja_NM_Spk9_U_8105853265_Utterance_23_425_450.wav,9.892
NM,M,Spk9,U_8105853265,425_450,Nyanja_NM_Spk9_U_8105853265_Utterance_24,ndizabwera tsiku lina kuti ndizaonane ndi amuna anu ndifuna tikakambitsana pa za a kavalo,Nyanja_NM_Spk9_U_8105853265_Utterance_24_425_450.wav,9.59
NM,M,Spk9,U_8105853265,425_450,Nyanja_NM_Spk9_U_8105853265_Utterance_25,anathamangira mu mitengo naimitsa mzibambo wamtali ndi olimba koma ooonda,Nyanja_NM_Spk9_U_8105853265_Utterance_25_425_450.wav,11.538
NM,M,Spk9,U_8105853265,400_425,Nyanja_NM_Spk9_U_8105853265_Utterance_1,tsistsi yace inali yaulutsi wofilira ndipo inagwera mu khosi mwace zomangidwa zace zita oneka bwino,Nyanja_NM_Spk9_U_8105853265_Utterance_1_400_425.wav,13.955
NM,M,Spk9,U_8105853265,400_425,Nyanja_NM_Spk9_U_8105853265_Utterance_2,kuli m'modzi ndipo kulinso wina osedwa dudley ndi flint,Nyanja_NM_Spk9_U_8105853265_Utterance_2_400_425.wav,5.66
NM,M,Spk9,U_8105853265,400_425,Nyanja_NM_Spk9_U_8105853265_Utterance_3,pali izi madame anaceuka nazungulusa maso ace modabwa ca kumene kunali comte mofuna kuona cinali kucitika,Nyanja_NM_Spk9_U_8105853265_Utterance_3_400_425.wav,11.047
NM,M,Spk9,U_8105853265,400_425,Nyanja_NM_Spk9_U_8105853265_Utterance_4,mobwereza anasakira maganizo ace osati mopanda phindu ngati poyamba,Nyanja_NM_Spk9_U_8105853265_Utterance_4_400_425.wav,6.965
NM,M,Spk9,U_8105853265,400_425,Nyanja_NM_Spk9_U_8105853265_Utterance_5,tiyeni tinve zoganizirazo ndizafunafuna ambuni,Nyanja_NM_Spk9_U_8105853265_Utterance_5_400_425.wav,5.57
NM,M,Spk9,U_8105853265,400_425,Nyanja_NM_Spk9_U_8105853265_Utterance_6,kweni kweni sindiganiza kuti mwina anadziwa zambiri za izo bambo holmes,Nyanja_NM_Spk9_U_8105853265_Utterance_6_400_425.wav,9.65
NM,M,Spk9,U_8105853265,400_425,Nyanja_NM_Spk9_U_8105853265_Utterance_7,ndimatopa nazo kuona azibambo ndi akavalo akuyenda-yenda akuyenda-yenda,Nyanja_NM_Spk9_U_8105853265_Utterance_7_400_425.wav,10.13
NM,M,Spk9,U_8105853265,400_425,Nyanja_NM_Spk9_U_8105853265_Utterance_8,mu kuumitsa kwanga ndinasemera mcira pamwamba monga ngati ndi mutu,Nyanja_NM_Spk9_U_8105853265_Utterance_8_400_425.wav,10.94
NM,M,Spk9,U_8105853265,400_425,Nyanja_NM_Spk9_U_8105853265_Utterance_9,kulibe zina zambiri kopotsa izi kulibe ngakhale nzanja kumene ingathe kuikidwako,Nyanja_NM_Spk9_U_8105853265_Utterance_9_400_425.wav,10.04
NM,M,Spk9,U_8105853265,400_425,Nyanja_NM_Spk9_U_8105853265_Utterance_10,zithunzi-thunzi ca bwato/ngalawa cinali kuooneka poyera pa mwamba pa mafunde,Nyanja_NM_Spk9_U_8105853265_Utterance_10_400_425.wav,11.535
NM,M,Spk9,U_8105853265,400_425,Nyanja_NM_Spk9_U_8105853265_Utterance_11,anali kufuna kuonako ma buku atsopano ndi magazini ndi zolankhulapo za achifundo odziwika ndi zosinta zina,Nyanja_NM_Spk9_U_8105853265_Utterance_11_400_425.wav,13.11
NM,M,Spk9,U_8105853265,400_425,Nyanja_NM_Spk9_U_8105853265_Utterance_12,chimbalangondo  anagwedeza mbari za thupi lace ndipo mau odziwika anayankha,Nyanja_NM_Spk9_U_8105853265_Utterance_12_400_425.wav,14.237
NM,M,Spk9,U_8105853265,400_425,Nyanja_NM_Spk9_U_8105853265_Utterance_13,ndicabwino kuti iwe ulankhule bambo okalamba anayankha nyancito okwiya,Nyanja_NM_Spk9_U_8105853265_Utterance_13_400_425.wav,10.67
NM,M,Spk9,U_8105853265,400_425,Nyanja_NM_Spk9_U_8105853265_Utterance_14,mwatsopano iye alumpha pansi pa cipinda cake ndi mapondedwe anzeru,Nyanja_NM_Spk9_U_8105853265_Utterance_14_400_425.wav,9.275
NM,M,Spk9,U_8105853265,400_425,Nyanja_NM_Spk9_U_8105853265_Utterance_15,analankhula wopelekedza atalephera kudikila ndipo unali iwe umene ndinapatsa kacola moika ndalama zanga,Nyanja_NM_Spk9_U_8105853265_Utterance_15_400_425.wav,15.454
NM,M,Spk9,U_8105853265,400_425,Nyanja_NM_Spk9_U_8105853265_Utterance_16,hakoni kuzakhala nthawi zonse mlimi mzako,Nyanja_NM_Spk9_U_8105853265_Utterance_16_400_425.wav,6.305
NM,M,Spk9,U_8105853265,400_425,Nyanja_NM_Spk9_U_8105853265_Utterance_17,pothera peni peni kuphatikidzidwa ka thonje kunaoneka kwa ena aliyense ngati cilungamo cotsimikidzidwa ndipo cina konzedwa kupita ku boma la pamwamba,Nyanja_NM_Spk9_U_8105853265_Utterance_17_400_425.wav,18.735
NM,M,Spk9,U_8105853265,400_425,Nyanja_NM_Spk9_U_8105853265_Utterance_18,zizindikiro zosaoneka zonse za nkhani imeniyi za zocitika za panopa zaonetsedwa kale,Nyanja_NM_Spk9_U_8105853265_Utterance_18_400_425.wav,12.318
NM,M,Spk9,U_8105853265,400_425,Nyanja_NM_Spk9_U_8105853265_Utterance_19,pamenepo lake anaseka mosakweza mau  ali kupenyabe pa khadi ya masewera a njuga ndi maso ace ochenjera,Nyanja_NM_Spk9_U_8105853265_Utterance_19_400_425.wav,16.265
NM,M,Spk9,U_8105853265,400_425,Nyanja_NM_Spk9_U_8105853265_Utterance_20,ngati nzika yapadera ndizakhala ngati cisanzo camwambo poti ngati sininacite tero zimenezo zinghalete mabvuto oopysa,Nyanja_NM_Spk9_U_8105853265_Utterance_20_400_425.wav,20.343
NM,M,Spk9,U_8105853265,400_425,Nyanja_NM_Spk9_U_8105853265_Utterance_21,thonje ndi cinthu cabwino si anyamata iye anatero poyamba,Nyanja_NM_Spk9_U_8105853265_Utterance_21_400_425.wav,9.275
NM,M,Spk9,U_8105853265,400_425,Nyanja_NM_Spk9_U_8105853265_Utterance_22,bill harmon anakuwa mokweza kwa akazi ace pamene anali kupita pa holo yotsanikidwa bwino,Nyanja_NM_Spk9_U_8105853265_Utterance_22_400_425.wav,15.83
NM,M,Spk9,U_8105853265,400_425,Nyanja_NM_Spk9_U_8105853265_Utterance_23,inde wokondedwa wanga watson ndakwanitsa kuziwa cinsinsi (zobisika),Nyanja_NM_Spk9_U_8105853265_Utterance_23_400_425.wav,11.0
NM,M,Spk9,U_8105853265,400_425,Nyanja_NM_Spk9_U_8105853265_Utterance_24,inde ndakhala kuno pa kotala wa ola ino anayankha la vallierie,Nyanja_NM_Spk9_U_8105853265_Utterance_24_400_425.wav,9.62
NM,M,Spk9,U_8105853265,400_425,Nyanja_NM_Spk9_U_8105853265_Utterance_25,sindingathe kupweteka ciliconse ndidzindikila sitizasokoneza cina cili conse munjira iliyonse,Nyanja_NM_Spk9_U_8105853265_Utterance_25_400_425.wav,9.5
